{
  "$schema": "https://json-schema.org/draft/2020-12/schema",
  "$id": "https://optees.org/schemas/simulator/v1/settlement_outcome.v1.json",
  "title": "SettlementOutcome",
  "description": "Terminal outcome of a pending transition evaluated at settlement time against observed market evidence.",
  "type": "object",
  "required": [
    "$type",
    "schema_version",
    "settlement_outcome_id",
    "pending_transition_id",
    "decision_id",
    "round_id",
    "policy_id",
    "status",
    "settled_at",
    "applied_transition_id",
    "rejection_reasons",
    "settlement_evidence"
  ],
  "additionalProperties": false,
  "allOf": [
    {
      "if": {
        "properties": {
          "status": {
            "const": "SETTLED"
          }
        }
      },
      "then": {
        "properties": {
          "applied_transition_id": {
            "type": "string",
            "pattern": "^trn_[a-zA-Z0-9_-]+$"
          },
          "rejection_reasons": {
            "maxItems": 0
          },
          "settlement_evidence": {
            "required": [
              "observation_id",
              "selected_revision",
              "execution_fill_time",
              "observation_knowledge_time",
              "execution_price"
            ]
          }
        }
      },
      "else": {
        "properties": {
          "applied_transition_id": {
            "type": "null"
          },
          "rejection_reasons": {
            "minItems": 1
          }
        }
      }
    }
  ],
  "properties": {
    "$type": {
      "type": "string",
      "const": "settlement_outcome"
    },
    "schema_version": {
      "type": "string",
      "const": "1.0.0"
    },
    "settlement_outcome_id": {
      "type": "string",
      "pattern": "^set-out_[a-zA-Z0-9_-]+$"
    },
    "pending_transition_id": {
      "type": "string",
      "pattern": "^pnd_[a-zA-Z0-9_-]+$"
    },
    "decision_id": {
      "type": "string",
      "pattern": "^dec-prop_[a-zA-Z0-9_-]+$"
    },
    "round_id": {
      "type": "string",
      "pattern": "^rnd_[a-zA-Z0-9_-]+$"
    },
    "policy_id": {
      "type": "string",
      "pattern": "^pol-def_[a-zA-Z0-9_-]+$"
    },
    "status": {
      "type": "string",
      "enum": [
        "SETTLED",
        "REJECTED"
      ]
    },
    "settled_at": {
      "type": "string",
      "pattern": "^\\d{4}-\\d{2}-\\d{2}T\\d{2}:\\d{2}:\\d{2}(\\.\\d+)?Z$"
    },
    "applied_transition_id": {
      "type": [
        "string",
        "null"
      ],
      "pattern": "^trn_[a-zA-Z0-9_-]+$"
    },
    "rejection_reasons": {
      "type": "array",
      "maxItems": 16,
      "items": {
        "type": "object",
        "required": [
          "code",
          "message",
          "violating_field"
        ],
        "additionalProperties": false,
        "properties": {
          "code": {
            "type": "string",
            "pattern": "^[A-Z][A-Z0-9_]{0,127}$"
          },
          "message": {
            "type": "string",
            "minLength": 1,
            "maxLength": 512
          },
          "violating_field": {
            "type": [
              "string",
              "null"
            ],
            "maxLength": 256
          }
        }
      }
    },
    "settlement_evidence": {
      "type": "object",
      "additionalProperties": false,
      "properties": {
        "observation_id": {
          "type": "string",
          "minLength": 1
        },
        "selected_revision": {
          "type": "integer",
          "minimum": 1
        },
        "execution_fill_time": {
          "type": "string",
          "pattern": "^\\d{4}-\\d{2}-\\d{2}T\\d{2}:\\d{2}:\\d{2}(\\.\\d+)?Z$"
        },
        "observation_knowledge_time": {
          "type": "string",
          "pattern": "^\\d{4}-\\d{2}-\\d{2}T\\d{2}:\\d{2}:\\d{2}(\\.\\d+)?Z$"
        },
        "execution_price": {
          "type": "string",
          "pattern": "^\\d+(\\.\\d+)?$"
        },
        "total_fee_deducted": {
          "type": "string",
          "pattern": "^\\d+(\\.\\d+)?$"
        },
        "cash_available": {
          "type": "string",
          "pattern": "^\\d+(\\.\\d+)?$"
        },
        "cash_required": {
          "type": "string",
          "pattern": "^\\d+(\\.\\d+)?$"
        }
      }
    }
  }
}
